{
  "schema_version": "1.0.0",
  "kind": "scenario_asset_registry",
  "path_id": "data_analyst",
  "batch_id": "final_batch_005_da_sql_canary",
  "scenarios": [
    {
      "scenario_id": "scenario_sql_shop",
      "name": "Greenleaf Online Shop",
      "summary": "A small fictional e-commerce business, Greenleaf Online Shop, stores its data in a relational database with a customers table and an orders table. Learners query these tables to practise SELECT, aliasing, DISTINCT and basic data-quality checks.",
      "locale": "NG",
      "currency": "NGN",
      "domain": "e-commerce",
      "glossary_example_vocab": [
        "customers",
        "orders",
        "products",
        "customer_id",
        "name",
        "city",
        "order_id",
        "delivery_time_minutes",
        "o",
        "Lagos",
        "Abuja",
        "Kano",
        "customer_name",
        "first_name",
        "country",
        "SELECT",
        "FROM",
        "AS",
        "DISTINCT",
        "ALL"
      ]
    }
  ],
  "assets": [
    {
      "asset_id": "ds_customers",
      "asset_kind": "dataset",
      "scenario_id": "scenario_sql_shop",
      "title": "customers",
      "description": "The customers table for Greenleaf Online Shop. Each row is one customer. Used for SELECT, AS, and DISTINCT examples.",
      "columns": [
        {
          "name": "customer_id",
          "type": "integer",
          "semantic_role": "identifier",
          "description": "Unique integer identifier for each customer",
          "numeric_looking_label": true
        },
        {
          "name": "name",
          "type": "string",
          "semantic_role": "text",
          "description": "Full name of the customer"
        },
        {
          "name": "city",
          "type": "string",
          "semantic_role": "categorical",
          "description": "City where the customer is located"
        }
      ],
      "rows": [
        [
          1,
          "Amara Okafor",
          "Lagos"
        ],
        [
          2,
          "Chidi Nwosu",
          "Abuja"
        ],
        [
          3,
          "Fatima Bello",
          "Lagos"
        ],
        [
          4,
          "Emeka Eze",
          "Kano"
        ],
        [
          5,
          "Ngozi Adeyemi",
          "Abuja"
        ],
        [
          6,
          "Tunde Adesanya",
          "Lagos"
        ],
        [
          7,
          "Aisha Musa",
          "Kano"
        ],
        [
          8,
          "Yemi Okonkwo",
          "Abuja"
        ]
      ],
      "variants": [
        {
          "variant_id": "ds_customers_messy",
          "derived_from": "ds_customers",
          "purpose": "find_issues practice: one inconsistent-casing city value and one duplicate row",
          "ops": [
            {
              "op": "set_cell",
              "where": {
                "customer_id": 1
              },
              "column": "city",
              "value": "lagos"
            },
            {
              "op": "duplicate_row",
              "where": {
                "customer_id": 4
              },
              "insert": "end"
            }
          ],
          "planted_issues": [
            {
              "issue_id": "issue_cust_city_casing",
              "kind": "inconsistent_category",
              "locations": [
                {
                  "where": {
                    "customer_id": 1
                  },
                  "column": "city"
                }
              ],
              "description": "City value 'lagos' uses lower-case while all other city values use title-case (e.g. 'Lagos').",
              "rule": {
                "column": "city",
                "op": "casing_differs_from_siblings"
              }
            },
            {
              "issue_id": "issue_cust_duplicate",
              "kind": "duplicate_row",
              "locations": [
                {
                  "where": {
                    "customer_id": 4
                  },
                  "occurrence": 1,
                  "column": "customer_id"
                }
              ],
              "description": "Customer 4 (Emeka Eze, Kano) appears twice — the second row is an exact duplicate."
            }
          ]
        }
      ],
      "provenance": "authored"
    },
    {
      "asset_id": "ds_orders",
      "asset_kind": "dataset",
      "scenario_id": "scenario_sql_shop",
      "title": "orders",
      "description": "The orders table for Greenleaf Online Shop. Each row is one order. Used for aliasing (FROM orders AS o) and delivery-time queries.",
      "columns": [
        {
          "name": "order_id",
          "type": "integer",
          "semantic_role": "identifier",
          "description": "Unique integer identifier for each order",
          "numeric_looking_label": true
        },
        {
          "name": "customer_id",
          "type": "integer",
          "semantic_role": "identifier",
          "description": "Foreign key referencing the customer who placed the order",
          "numeric_looking_label": true
        },
        {
          "name": "delivery_time_minutes",
          "type": "integer",
          "semantic_role": "numerical",
          "unit": "minutes",
          "description": "Number of minutes from order placement to delivery"
        }
      ],
      "rows": [
        [
          1001,
          1,
          32
        ],
        [
          1002,
          3,
          47
        ],
        [
          1003,
          2,
          19
        ],
        [
          1004,
          5,
          55
        ],
        [
          1005,
          1,
          28
        ],
        [
          1006,
          4,
          63
        ],
        [
          1007,
          6,
          41
        ],
        [
          1008,
          2,
          22
        ],
        [
          1009,
          7,
          38
        ],
        [
          1010,
          8,
          51
        ]
      ],
      "variants": [
        {
          "variant_id": "ds_orders_messy",
          "derived_from": "ds_orders",
          "purpose": "find_issues practice: one impossible negative delivery time and one missing customer_id",
          "ops": [
            {
              "op": "set_cell",
              "where": {
                "order_id": 1006
              },
              "column": "delivery_time_minutes",
              "value": -5
            },
            {
              "op": "set_cell",
              "where": {
                "order_id": 1003
              },
              "column": "customer_id",
              "value": null
            }
          ],
          "planted_issues": [
            {
              "issue_id": "issue_ord_negative_delivery",
              "kind": "impossible_value",
              "locations": [
                {
                  "where": {
                    "order_id": 1006
                  },
                  "column": "delivery_time_minutes"
                }
              ],
              "description": "delivery_time_minutes is -5, which is impossible — delivery time cannot be negative.",
              "rule": {
                "column": "delivery_time_minutes",
                "op": "lt",
                "value": 0
              }
            },
            {
              "issue_id": "issue_ord_missing_customer",
              "kind": "missing_value",
              "locations": [
                {
                  "where": {
                    "order_id": 1003
                  },
                  "column": "customer_id"
                }
              ],
              "description": "customer_id is NULL for order 1003 — every order must reference a customer."
            }
          ]
        }
      ],
      "provenance": "authored"
    }
  ]
}
