{
  "schema_version": "0.1.0",
  "kind": "scenario_asset_registry",
  "path_id": "data_analyst",
  "batch_id": "final_batch_001_da_canary",
  "scenarios": [
    {
      "scenario_id": "northstar_store",
      "name": "Northstar Store",
      "summary": "A small Lagos-based online store that delivers its own orders. Every Data Analyst example uses its order records so that tables, columns and numbers stay consistent from tile to tile.",
      "locale": "en-NG",
      "currency": "NGN",
      "domain": "retail delivery",
      "glossary_example_vocab": [
        "delivery orders",
        "order number",
        "city",
        "Lagos",
        "Abuja",
        "Kano",
        "delivery time",
        "driver",
        "zone_code"
      ]
    }
  ],
  "assets": [
    {
      "asset_id": "northstar_orders",
      "asset_kind": "dataset",
      "scenario_id": "northstar_store",
      "title": "Northstar orders",
      "description": "Six delivered orders. Column roles are declared so categorical/numerical answer keys can be checked by script.",
      "columns": [
        {
          "name": "order_id",
          "type": "string",
          "semantic_role": "identifier",
          "description": "Unique order number"
        },
        {
          "name": "customer_segment",
          "type": "string",
          "semantic_role": "categorical",
          "description": "Student, Professional or Business"
        },
        {
          "name": "city",
          "type": "string",
          "semantic_role": "categorical",
          "description": "Destination city"
        },
        {
          "name": "zone_code",
          "type": "integer",
          "semantic_role": "categorical",
          "numeric_looking_label": true,
          "description": "Delivery zone label written as digits: a label, not a quantity"
        },
        {
          "name": "items",
          "type": "integer",
          "semantic_role": "numerical",
          "description": "Number of items in the order"
        },
        {
          "name": "order_value_ngn",
          "type": "number",
          "semantic_role": "numerical",
          "unit": "NGN",
          "description": "Order value in naira"
        },
        {
          "name": "payment_method",
          "type": "string",
          "semantic_role": "categorical",
          "description": "Transfer, Card or Cash"
        },
        {
          "name": "driver",
          "type": "string",
          "semantic_role": "categorical",
          "description": "Driver who delivered the order"
        },
        {
          "name": "delivery_minutes",
          "type": "integer",
          "semantic_role": "numerical",
          "unit": "minutes",
          "description": "Minutes from dispatch to arrival"
        }
      ],
      "rows": [
        [
          "NS1001",
          "Student",
          "Lagos",
          101,
          2,
          8500,
          "Transfer",
          "Tunde",
          35
        ],
        [
          "NS1002",
          "Professional",
          "Abuja",
          204,
          1,
          12400,
          "Card",
          "Amaka",
          48
        ],
        [
          "NS1003",
          "Student",
          "Kano",
          310,
          3,
          6700,
          "Transfer",
          "Seyi",
          41
        ],
        [
          "NS1004",
          "Business",
          "Lagos",
          102,
          5,
          24600,
          "Card",
          "Tunde",
          62
        ],
        [
          "NS1005",
          "Professional",
          "Abuja",
          205,
          2,
          15800,
          "Transfer",
          "Amaka",
          39
        ],
        [
          "NS1006",
          "Student",
          "Lagos",
          103,
          1,
          4200,
          "Cash",
          "Seyi",
          52
        ]
      ],
      "provenance": "authored",
      "variants": [
        {
          "variant_id": "messy",
          "derived_from": "base",
          "purpose": "Data-quality exercises: one missing value, one impossible value, one duplicate row, one inconsistent category.",
          "ops": [
            {
              "op": "set_cell",
              "where": {
                "order_id": "NS1003"
              },
              "column": "city",
              "value": null
            },
            {
              "op": "set_cell",
              "where": {
                "order_id": "NS1004"
              },
              "column": "items",
              "value": -2
            },
            {
              "op": "duplicate_row",
              "where": {
                "order_id": "NS1004"
              },
              "insert": "after"
            },
            {
              "op": "set_cell",
              "where": {
                "order_id": "NS1005"
              },
              "column": "payment_method",
              "value": "card"
            },
            {
              "op": "drop_rows",
              "where": {
                "order_id": "NS1006"
              }
            }
          ],
          "planted_issues": [
            {
              "issue_id": "i_missing_city",
              "kind": "missing_value",
              "description": "Order NS1003 has no city recorded.",
              "locations": [
                {
                  "where": {
                    "order_id": "NS1003"
                  },
                  "column": "city"
                }
              ]
            },
            {
              "issue_id": "i_impossible_items",
              "kind": "impossible_value",
              "description": "An order cannot contain -2 items.",
              "locations": [
                {
                  "where": {
                    "order_id": "NS1004"
                  },
                  "occurrence": 0,
                  "column": "items"
                }
              ],
              "rule": {
                "column": "items",
                "op": "lt",
                "value": 0
              }
            },
            {
              "issue_id": "i_duplicate_order",
              "kind": "duplicate_row",
              "description": "Order NS1004 appears twice with identical values.",
              "locations": [
                {
                  "where": {
                    "order_id": "NS1004"
                  },
                  "occurrence": 1,
                  "column": "order_id"
                }
              ]
            },
            {
              "issue_id": "i_inconsistent_payment",
              "kind": "inconsistent_category",
              "description": "The same payment method is written 'Card' and 'card'.",
              "locations": [
                {
                  "where": {
                    "order_id": "NS1005"
                  },
                  "column": "payment_method"
                }
              ],
              "rule": {
                "column": "payment_method",
                "op": "casing_differs_from_siblings"
              }
            }
          ]
        }
      ]
    }
  ],
  "provenance": {
    "model": "claude (canary, authored by orchestrator)",
    "generated_at": "2026-10-20T00:00:00Z"
  }
}
