{
  "schema_version": "1.0.0",
  "kind": "scenario_asset_registry",
  "path_id": "data_analyst",
  "batch_id": "final_batch_002_da_canary_llm",
  "scenarios": [
    {
      "scenario_id": "scenario_courier_orders",
      "name": "Kwik Courier — Delivery Orders",
      "summary": "A small fictional courier company, Kwik Courier, records every delivery it makes. Each delivery is logged with an order number, the destination city, the delivery time in minutes, the driver name, and a numeric zone code. This dataset is the running example throughout the tile: learners first see it as a plain table of rows and columns, then classify each column as categorical or numerical.",
      "locale": "NG",
      "currency": "NGN",
      "domain": "logistics",
      "glossary_example_vocab": [
        "dataset",
        "data matrix",
        "observation",
        "record",
        "variable",
        "row",
        "column",
        "delivery orders",
        "courier company",
        "order number",
        "city",
        "delivery time",
        "driver",
        "Lagos",
        "Abuja",
        "Kano",
        "zone_code",
        "numerical variable",
        "categorical variable",
        "levels",
        "order #1042",
        "order #1043",
        "32 minutes",
        "41 minutes",
        "101",
        "102",
        "103"
      ]
    }
  ],
  "assets": [
    {
      "asset_id": "ds_courier_orders_base",
      "asset_kind": "dataset",
      "scenario_id": "scenario_courier_orders",
      "title": "Kwik Courier — Delivery Orders (clean)",
      "description": "Ten delivery records for Kwik Courier. Covers every column the glossary teaching blocks name: order_id (identifier), city (categorical), delivery_min (numerical), driver (categorical), zone_code (numeric-looking categorical label). Used for the rows-and-columns explainer and the field-selection practice.",
      "columns": [
        {
          "name": "order_id",
          "type": "integer",
          "semantic_role": "identifier",
          "description": "Unique order number (e.g. 1042, 1043). A label, not a quantity.",
          "numeric_looking_label": true
        },
        {
          "name": "city",
          "type": "string",
          "semantic_role": "categorical",
          "description": "Destination city for the delivery (Lagos, Abuja, Kano). Values are category labels."
        },
        {
          "name": "delivery_min",
          "type": "integer",
          "semantic_role": "numerical",
          "unit": "minutes",
          "description": "Time taken to complete the delivery in minutes. Arithmetic (sum, difference) is meaningful."
        },
        {
          "name": "driver",
          "type": "string",
          "semantic_role": "categorical",
          "description": "Name of the driver who handled the delivery. A category label."
        },
        {
          "name": "zone_code",
          "type": "integer",
          "semantic_role": "categorical",
          "description": "Numeric zone code for the delivery area (101, 102, 103). Stored as digits but arithmetic is meaningless — a categorical label.",
          "numeric_looking_label": true
        }
      ],
      "rows": [
        [
          1042,
          "Lagos",
          32,
          "Emeka Obi",
          101
        ],
        [
          1043,
          "Abuja",
          41,
          "Fatima Bello",
          102
        ],
        [
          1044,
          "Kano",
          55,
          "Chidi Nwosu",
          103
        ],
        [
          1045,
          "Lagos",
          28,
          "Emeka Obi",
          101
        ],
        [
          1046,
          "Abuja",
          37,
          "Yemi Adeyemi",
          102
        ],
        [
          1047,
          "Kano",
          62,
          "Fatima Bello",
          103
        ],
        [
          1048,
          "Lagos",
          44,
          "Chidi Nwosu",
          101
        ],
        [
          1049,
          "Abuja",
          31,
          "Emeka Obi",
          102
        ],
        [
          1050,
          "Kano",
          50,
          "Yemi Adeyemi",
          103
        ],
        [
          1051,
          "Lagos",
          38,
          "Fatima Bello",
          101
        ]
      ],
      "provenance": "authored",
      "variants": [
        {
          "variant_id": "ds_courier_orders_messy",
          "derived_from": "ds_courier_orders_base",
          "purpose": "Messy version with three planted data-quality issues for the find_issues interaction on data.categorical_numeric_types.",
          "ops": [
            {
              "op": "set_cell",
              "where": {
                "order_id": 1044
              },
              "occurrence": 0,
              "column": "delivery_min",
              "value": -5
            },
            {
              "op": "set_cell",
              "where": {
                "order_id": 1048
              },
              "occurrence": 0,
              "column": "city",
              "value": "lagos"
            },
            {
              "op": "set_cell",
              "where": {
                "order_id": 1050
              },
              "occurrence": 0,
              "column": "driver",
              "value": null
            }
          ],
          "planted_issues": [
            {
              "issue_id": "issue_negative_delivery_time",
              "kind": "impossible_value",
              "locations": [
                {
                  "where": {
                    "order_id": 1044
                  },
                  "occurrence": 0,
                  "column": "delivery_min"
                }
              ],
              "description": "delivery_min is -5 for order 1044. Delivery time cannot be negative — this is an impossible value.",
              "rule": {
                "column": "delivery_min",
                "op": "lt",
                "value": 0
              }
            },
            {
              "issue_id": "issue_city_casing",
              "kind": "inconsistent_category",
              "locations": [
                {
                  "where": {
                    "order_id": 1048
                  },
                  "occurrence": 0,
                  "column": "city"
                }
              ],
              "description": "city is 'lagos' (lowercase) for order 1048, while all other Lagos entries use 'Lagos'. Inconsistent casing creates a spurious extra category.",
              "rule": {
                "column": "city",
                "op": "casing_differs_from_siblings"
              }
            },
            {
              "issue_id": "issue_missing_driver",
              "kind": "missing_value",
              "locations": [
                {
                  "where": {
                    "order_id": 1050
                  },
                  "occurrence": 0,
                  "column": "driver"
                }
              ],
              "description": "driver is null for order 1050. The driver name was not recorded for this delivery."
            }
          ]
        }
      ]
    }
  ],
  "provenance": {
    "model": "claude-opus-4-5",
    "generated_at": "2026-10-20T18:30:00+00:00"
  }
}
